{
  "batch_id": "B06",
  "status": "passed",
  "commit_sha": "344af4f03f60d66dd29d63e9563261aa523ff346",
  "environment": "integration",
  "started_at": "2026-08-19T10:46:02Z",
  "completed_at": "2026-08-19T10:47:15Z",
  "executor": "claude-agent",
  "reviewer": "Ethan",
  "artifacts": [
    {
      "path": "governance/evidence-policy.json",
      "sha256": "39727f04fb92aa3e89ff9ec253ac6530fddc140cea2778523656e653d3ee94b0"
    },
    {
      "path": "scripts/batch.py",
      "sha256": "a0f028915862753421f1d5cff2b00be0e9b2881864fb6f0dc53ffb83a45b14fb"
    },
    {
      "path": "scripts/rule-knockout.py",
      "sha256": "2cbd63ee383f8d1bf0013e0479a863c7375935de24ca64e4a33072e69c1e1399"
    },
    {
      "path": "tools/paygov/evidence.py",
      "sha256": "29c43af370f01ad5f7f8eab9bda03da013a5a35a703bdf7ad9bcc1e3c92b7411"
    },
    {
      "path": "tools/paygov/orchestration.py",
      "sha256": "1e3803fa15029495bc4d6c72dfc497f3de00f72c23d39d79f39b7497c3fe1d3d"
    },
    {
      "path": "tools/tests/test_b06_evidence.py",
      "sha256": "5a1d5a36a6dbd5912c012549257168b1bc3c25d3971ae6cd9ebcd704361f3b80"
    },
    {
      "path": "tools/tests/test_b06_orchestration.py",
      "sha256": "04973cc57772a995342eac4ec1e568190acec4ba272e1ef93bad6903db08bd9c"
    }
  ],
  "tests": {
    "passed": 1679,
    "failed": 0,
    "skipped_critical": 0
  },
  "security": {
    "blocking_findings": 0,
    "accepted_findings": 0
  },
  "dependency_hashes": {
    "B02": "5a807988833d74befcb6e7158d6a17d82ca305e5441ac08b95710baa67cb7074",
    "B05": "12d73c7df1b154916827cd42ab81cf986858f546a9d469e2a7a970d4b624d8ec"
  }
}
