{
  "batch_id": "B00",
  "status": "passed",
  "commit_sha": "bf0a26c388b01e04e03ec30ae4876eafe45f3805",
  "environment": "integration",
  "started_at": "2026-08-18T12:21:02Z",
  "completed_at": "2026-08-18T12:21:19Z",
  "executor": "claude-agent",
  "reviewer": "Ethan",
  "artifacts": [
    {
      "path": "docs/charter/PROGRAM_CHARTER.md",
      "sha256": "8d8be7abfb77037e2e064ea1a69baa63d4d3d11ed52962ace7734a47200f2997"
    },
    {
      "path": "docs/charter/RISK_ACCEPTANCE_POLICY.md",
      "sha256": "66b3dd3fe7c388aaba1f3a2aee0bdf41ccf557625a03f43de3d6f93ac9dad246"
    },
    {
      "path": "docs/charter/DELIVERY_MODEL.md",
      "sha256": "31e0ad9f86aff223f7d546a75c7fc6f8a587829aa4c1f7ee48b09dd32c290075"
    },
    {
      "path": "governance/project-config.json",
      "sha256": "dc15e5ddfc4ffdca77b1afb1598b89372c9e69918536e64cde95a67e03d6c561"
    },
    {
      "path": "governance/non-negotiables.json",
      "sha256": "88ca0ad3c9c738d8fc8902cc7004a7f68a02c4063ee2146cdc83b4b5abf3cbbb"
    },
    {
      "path": "governance/module-registry.json",
      "sha256": "e1b832eea4a4acae1194961187e2d4e3ca1205f003dad1148962929c57d0dccd"
    },
    {
      "path": "tools/paygov/__init__.py",
      "sha256": "897b8ccacefb1b70fa9a14a32eed140ce7e0ca5402b15d3e458ed5a314e5cd19"
    },
    {
      "path": "tools/paygov/errors.py",
      "sha256": "78c8416ff936dd09a44d6167536dd7d88ca25e50dbf55e3edc8e52adad352e56"
    },
    {
      "path": "tools/paygov/repo.py",
      "sha256": "d171dbe2f9a7d06e6b2176d6feeb422b1c36f2e7eabf627fca831e3cda02a95b"
    },
    {
      "path": "tools/paygov/structs.py",
      "sha256": "760fc9d6373d2385aba4886d502f2bac68c5422d92ce448169e42949b0243dff"
    },
    {
      "path": "tools/paygov/registry.py",
      "sha256": "cca16e6c4b18de10081ccadcb4cdac7df0095b30ecabcf008a297a5b1824541c"
    },
    {
      "path": "tools/paygov/charter.py",
      "sha256": "7a321e679d2acb6fc4d7be11f377e0e8e6932bfcb7db118f7ab91cc6051b5bca"
    },
    {
      "path": "tools/paygov/config.py",
      "sha256": "594c9fa60ff509a43ebaeabdcb63fe1322751fe60911b6a37661919dc948338e"
    },
    {
      "path": "tools/paygov/nonneg.py",
      "sha256": "2a493d25f969ed960334014b410a7a53f2435f7fbaf3b3e11c21ccb0bf3a1000"
    },
    {
      "path": "tools/paygov/modules.py",
      "sha256": "1ae3c80e473eb4cb0729351e833e194d869b55ffdb36450f0ce9c7bd063a5d01"
    },
    {
      "path": "tools/paygov/hygiene.py",
      "sha256": "f3faa1316a7a61eab202032a42e34991cd2a75df66fe561991fc724243f48f8c"
    },
    {
      "path": "tools/paygov/cli.py",
      "sha256": "b00860a0a4009e87cfca16f0a92af5469e82b3208e479a5f85be34135b391f88"
    },
    {
      "path": "tools/tests/support.py",
      "sha256": "af0f15adb2e2a64e5393a878dd808ab10eb7da04ad638304e74ec7fd9fa0063b"
    },
    {
      "path": "tools/tests/test_b00_charter.py",
      "sha256": "8efa59c68f76f1c8e4aea16dbd530b8838a323b1579afd368e9b5e9c9d40cf09"
    },
    {
      "path": "tools/tests/test_b00_project_config.py",
      "sha256": "057d2fe1798c76181189a32342242d9f603c034ed0f4b7187e4dfff0abf0c1fd"
    },
    {
      "path": "tools/tests/test_b00_nonnegotiables.py",
      "sha256": "25a059f1a9e0e5d589cc7694a610a07221c394ca6ed9de35bbe5827c2f0e1b95"
    },
    {
      "path": "tools/tests/test_b00_module_registry.py",
      "sha256": "3bcda96973200f8c9226508a9c0efe6c0b545f1e5ef9dcb31b533fb2d0fa2993"
    },
    {
      "path": "tools/tests/test_b00_repo_hygiene.py",
      "sha256": "0270447defceab7a9df7febc1283b699eee0ccc6463b03d50b6860af84928c35"
    },
    {
      "path": "tools/tests/test_b00_cli.py",
      "sha256": "b6b04f7da5f404ba293bd2ee0218c71ebe2aaff49519075ea185e751ec0d0036"
    },
    {
      "path": "scripts/record-commands.py",
      "sha256": "02d44c062d8df2d9fdc824ff7cd639664fe7917201949e79be69773421c403b0"
    },
    {
      "path": "scripts/make-completion.py",
      "sha256": "a4155fba0f3b529ff4ab140e4f2e3c2b9300ec5c448f514b5efde76a62d71c47"
    },
    {
      "path": "scripts/test-summary.py",
      "sha256": "4bc958118e1515a51484db4f3a36c276aa30f76c0c8fefac01b562e35e688979"
    },
    {
      "path": "scripts/negative-controls.py",
      "sha256": "ad3f95498d1aeaa6a213fccad9cf75990027ed29bec39cf48d109c91b77eeb7b"
    },
    {
      "path": "scripts/run-governance-tests.sh",
      "sha256": "f89cec12a60b04e60d3df0f68021379767ee304ef5be9c04fc4a40b4ecc75a81"
    },
    {
      "path": "CODEOWNERS",
      "sha256": "bc5ac0cc9d4631e6e5c165a51d717773af1cd7741e4dda496e376b6f1efbef45"
    },
    {
      "path": "README.md",
      "sha256": "f9005030f310f1a5ed90934f2fbb0d7cc22c1ace8bffe3569e190e4974686c97"
    },
    {
      "path": "SECURITY.md",
      "sha256": "a95f66bf8853bed100943eecfee784dc0f4b32d4237377f3cdb9b79d7d569936"
    },
    {
      "path": "Makefile",
      "sha256": "735bad6db8d6b33a66217844e6a9549f4997ce312d9a893348d3c6b4908f8f3f"
    }
  ],
  "tests": {
    "passed": 209,
    "failed": 0,
    "skipped_critical": 0
  },
  "security": {
    "blocking_findings": 0,
    "accepted_findings": 0
  },
  "dependency_hashes": {}
}
